{
  "$schema": "./contract.schema.json",
  "contractVersion": "0.3.2",
  "slug": "newsletter",
  "name": "Newsletter Signup",
  "registryId": "G2",
  "category": "marketing",
  "status": "pilot",
  "summary": "Email-capture section that composes Input and Button while leaving submission response ownership to the consuming target.",
  "dependencies": [
    "input",
    "button"
  ],
  "source": {
    "registry": "registry.json#/components/newsletter",
    "css": {
      "file": "components/css/marketing.css",
      "selector": ".newsletter"
    },
    "docs": "site/src/content/components/newsletter.mdx"
  },
  "anatomy": [
    {
      "name": "root",
      "selector": ".newsletter",
      "className": ".newsletter",
      "required": true,
      "description": "Title-labelled Newsletter section root omitted when required title or form composition is missing."
    },
    {
      "name": "content",
      "selector": ".newsletter__content",
      "className": ".newsletter__content",
      "required": true,
      "description": "Centered content wrapper."
    },
    {
      "name": "title",
      "selector": ".newsletter__title",
      "className": ".newsletter__title",
      "required": true,
      "description": "Signup heading."
    },
    {
      "name": "description",
      "selector": ".newsletter__description",
      "className": ".newsletter__description",
      "required": false,
      "description": "Optional signup context."
    },
    {
      "name": "form",
      "selector": ".newsletter__form",
      "className": ".newsletter__form",
      "required": true,
      "description": "Native form composition containing Input and Button dependencies."
    },
    {
      "name": "input",
      "selector": ".newsletter__input",
      "className": ".newsletter__input",
      "required": true,
      "description": "Newsletter sizing hook composed onto the Input dependency's native email field."
    },
    {
      "name": "note",
      "selector": ".newsletter__note",
      "className": ".newsletter__note",
      "required": false,
      "description": "Optional privacy or frequency note."
    },
    {
      "name": "status",
      "selector": ".newsletter__status",
      "className": ".newsletter__status",
      "required": false,
      "description": "Optional target-owned confirmed response hook; no neutral response state is implied."
    }
  ],
  "variants": [
    {
      "name": "default",
      "className": null,
      "default": true,
      "description": "Single centered signup presentation."
    }
  ],
  "sizes": [
    {
      "name": "default",
      "className": null,
      "default": true,
      "description": "Responsive form width supplied by canonical CSS."
    }
  ],
  "states": [
    {
      "name": "default",
      "selectors": [
        ".newsletter"
      ],
      "description": "Resting newsletter presentation; field states belong to the Input dependency."
    }
  ],
  "behavior": [
    {
      "name": "inputComposition",
      "selectors": [
        ".newsletter__form",
        ".newsletter__input"
      ],
      "description": "The email field composes Input anatomy and must preserve Input's default, error, success, warning, hover, focus-visible, disabled, label, and message obligations."
    },
    {
      "name": "formSubmission",
      "selectors": [
        ".newsletter__form"
      ],
      "events": [
        "submit"
      ],
      "description": "The native form emits submission to the consuming target; this contract does not choose endpoint, pending, success, error, retry, replacement, redirect, or other response ownership."
    },
    {
      "name": "responseBoundary",
      "selectors": [
        ".newsletter__status"
      ],
      "description": "A target may render a truthful confirmed result using timing-appropriate semantics; the result is form-level and must not be repurposed as the Email field's validation message."
    }
  ],
  "properties": [
    {
      "name": "title",
      "type": "string",
      "required": true,
      "description": "Newsletter signup heading.",
      "targetMappings": {
        "web": [
          {
            "kind": "content",
            "selector": ".newsletter__title"
          }
        ]
      }
    },
    {
      "name": "description",
      "type": "string",
      "required": false,
      "description": "Optional signup context.",
      "targetMappings": {
        "web": [
          {
            "kind": "content",
            "selector": ".newsletter__description"
          }
        ]
      }
    },
    {
      "name": "form",
      "type": "slot",
      "required": true,
      "description": "Native form content composed from Input and Button dependencies.",
      "targetMappings": {
        "web": [
          {
            "kind": "slot",
            "selector": ".newsletter__form",
            "classNames": [
              ".newsletter__form"
            ]
          }
        ]
      }
    },
    {
      "name": "note",
      "type": "string",
      "required": false,
      "description": "Optional privacy, consent, or message-frequency note.",
      "targetMappings": {
        "web": [
          {
            "kind": "content",
            "selector": ".newsletter__note"
          }
        ]
      }
    }
  ],
  "tokens": {
    "public": {
      "color": [
        "--color-surface-secondary",
        "--color-text-primary",
        "--color-text-secondary"
      ],
      "typography": [
        "--font-family-body",
        "--font-family-heading",
        "--tg-typography-body-caption-weight",
        "--tg-typography-body-default-weight",
        "--tg-typography-h3-weight",
        "--typo-body-line-height",
        "--typo-body-size",
        "--typo-caption-line-height",
        "--typo-caption-size",
        "--typo-h3-line-height",
        "--typo-h3-size",
        "--typo-newsletter-body-leading-min",
        "--typo-newsletter-heading-leading-min",
        "--typo-newsletter-caption-leading-min"
      ],
      "spacing": [
        "--space-layout-container",
        "--space-layout-element-gap",
        "--space-layout-section-gap",
        "--scale-newsletter-block-padding",
        "--scale-newsletter-inset-min",
        "--scale-newsletter-inset-share",
        "--scale-newsletter-inset-max",
        "--size-newsletter-content-max",
        "--scale-newsletter-content-gap",
        "--scale-newsletter-form-gap"
      ]
    }
  },
  "accessibility": [
    "Render the signup as a native form and use a submit-capable Button dependency.",
    "Compose the email control from Input with a visible label, native email semantics, stable submitted name, autocomplete, and required state when the target requires it.",
    "Preserve Input's default, error, success, and warning validation families; use aria-invalid only for error.",
    "Do not use placeholder text as the email field's only accessible name.",
    "Keep form-level response feedback separate from field guidance and validation messages.",
    "The consuming target must announce or navigate to a truthful submission result without this contract assuming where that response lives."
  ],
  "adapters": {
    "web": {
      "status": "implemented",
      "kind": "css",
      "notes": "Implemented in components/css/marketing.css."
    },
    "shopify": {
      "status": "implemented",
      "kind": "section-adapter",
      "notes": "Localized customer form uses canonical Input/Button markup, unique ids, platform field names, server error association, confirmed success, merchant content settings, and zero Newsletter JavaScript."
    },
    "react": {
      "status": "planned",
      "kind": "component"
    },
    "swiftui": {
      "status": "planned",
      "kind": "native-component"
    },
    "compose": {
      "status": "planned",
      "kind": "native-component"
    }
  }
}
